{
  "$schema": "http://json-schema.org/draft-07/schema#",
  "$id": "https://idealarmory.com/schemas/ia-product-feed-v1.json",
  "title": "Ideal Armory Product Feed",
  "description": "Feed contract for Ideal Armory's retailer aggregation pipeline. Validated and consumed by ia-adapter.js. Submit one feed file per pull cadence (hourly, daily, etc.) covering any subset of the 10 supported categories.",
  "type": "object",

  "required": ["version", "products"],

  "properties": {

    "version": {
      "type": "string",
      "description": "Feed schema version. Must be '1.0' for this schema.",
      "pattern": "^\\d+\\.\\d+$",
      "examples": ["1.0"]
    },

    "generated": {
      "type": "string",
      "format": "date-time",
      "description": "ISO 8601 timestamp when this feed file was generated by the aggregator pipeline.",
      "examples": ["2026-03-11T14:30:00Z"]
    },

    "source": {
      "type": "string",
      "description": "Human-readable name of the feed source / retailer network.",
      "examples": ["Ideal Armory Retailer Network", "GunBroker Feed v2"]
    },

    "products": {
      "type": "array",
      "description": "Array of product objects across any mix of supported categories.",
      "minItems": 1,
      "items": { "$ref": "#/definitions/Product" }
    }

  },

  "additionalProperties": false,

  "definitions": {

    "Product": {
      "type": "object",
      "title": "Product",
      "description": "A single product as aggregated from one or more licensed retailers.",

      "required": ["id", "category", "brand", "name", "sellers"],

      "properties": {

        "id": {
          "type": "string",
          "description": "Globally unique product identifier within this feed. Recommended format: '{category}-{sku}' or '{brand-slug}-{model-slug}'. Must be stable across feed refreshes so the adapter can detect updates.",
          "examples": ["handguns-glock-19-gen5", "ammo-federal-9mm-fmj-124gr-1000"]
        },

        "category": {
          "type": "string",
          "description": "Category slug. Determines which page the product appears on and which spec fields are relevant.",
          "enum": [
            "handguns",
            "rifles",
            "shotguns",
            "ammunition",
            "optics",
            "holsters",
            "ar-parts",
            "magazines",
            "cleaning",
            "gun-safes"
          ]
        },

        "brand": {
          "type": "string",
          "description": "Manufacturer or brand name as it should appear on the product card.",
          "examples": ["Glock", "Sig Sauer", "Federal Premium", "Vortex Optics"]
        },

        "name": {
          "type": "string",
          "description": "Product model name, without the brand prefix.",
          "examples": ["Glock 19 Gen 5", "Vortex Strikefire II", "Mossberg 500 Tactical"]
        },

        "sub": {
          "type": "string",
          "description": "Short subtitle shown below the product name on the card. Typically 3-8 words summarizing key specs.",
          "examples": ["9mm Compact Striker-Fired", "124gr FMJ 1000-Round Case", "Red Dot 4 MOA 1x"]
        },

        "description": {
          "type": "string",
          "description": "Long-form product description for the detail modal (2-4 sentences). Plain text, no HTML."
        },

        "img": {
          "type": "string",
          "description": "Absolute URL of the primary product image. Preferred: 800×600px minimum, white/transparent background, JPG or PNG. An empty string causes the placeholder text to render.",
          "examples": ["https://cdn.idealarmory.com/products/glock-19-gen5.jpg", ""]
        },

        "stars": {
          "type": "number",
          "description": "Average star rating (0–5). Aggregated across retailer and 3rd-party review sources.",
          "minimum": 0,
          "maximum": 5,
          "examples": [4.8, 4.5]
        },

        "reviews": {
          "type": "integer",
          "description": "Total review count shown alongside the star rating.",
          "minimum": 0,
          "examples": [3241, 180]
        },

        "badge": {
          "type": "string",
          "description": "'best' renders a 'Best Seller' badge on the product card. Empty string = no badge.",
          "enum": ["", "best", "new", "sale"],
          "default": ""
        },

        "sellers": {
          "type": "array",
          "description": "One entry per licensed retailer currently listing this product. The adapter sorts these cheapest-first. Maximum 10 sellers per product (top 3 are shown on the card, all appear in the detail modal).",
          "minItems": 1,
          "maxItems": 10,
          "items": { "$ref": "#/definitions/Seller" }
        },

        "specs": {
          "$ref": "#/definitions/Specs",
          "description": "Category-specific product specifications. The adapter flattens all spec fields directly onto the product object, so filter functions access them as p.caliber, p.action, etc."
        }

      },

      "additionalProperties": false
    },


    "Seller": {
      "type": "object",
      "title": "Seller",
      "description": "A single retailer listing for a product.",

      "required": ["name", "price", "stock"],

      "properties": {

        "name": {
          "type": "string",
          "description": "Retailer display name as it should appear in the seller price row.",
          "examples": ["Kygunco", "Bud's Gun Shop", "GrabAGun", "Guns.com", "Cabela's"]
        },

        "price": {
          "type": "number",
          "description": "Current listing price in USD (before tax and transfer fee). Must be ≥ 0.",
          "minimum": 0,
          "examples": [499.99, 21.95]
        },

        "stock": {
          "type": "string",
          "description": "'in' = in stock. 'low' = low stock / limited quantity. 'out' = out of stock (still shown but de-emphasized).",
          "enum": ["in", "low", "out"],
          "default": "in"
        },

        "url": {
          "type": "string",
          "description": "Affiliate or direct product URL. Opened in a new tab from the 'Go to Retailer' button in the detail modal. Use HTTPS.",
          "examples": ["https://www.kygunco.com/glock-19-gen5-9mm-pistol/?ref=idealarmory"]
        },

        "fflRequired": {
          "type": "boolean",
          "description": "True if this retailer ships to an FFL dealer (standard for all firearms). False for accessories, ammo, and optics that ship direct.",
          "default": false
        },

        "updatedAt": {
          "type": "string",
          "format": "date-time",
          "description": "ISO 8601 timestamp of the most recent price/stock update from this retailer. Used for price-history tracking (future feature).",
          "examples": ["2026-03-11T08:00:00Z"]
        }

      },

      "additionalProperties": false
    },


    "Specs": {
      "type": "object",
      "title": "Specs",
      "description": "Category-specific spec fields. All properties are optional at the schema level; required fields per category are enforced by the aggregator pipeline. The adapter flattens all fields onto the product object.",

      "properties": {

        "_comment_handguns": {
          "type": "string",
          "description": "── HANDGUNS ─────────────────────────────────────────────────────"
        },
        "caliber": {
          "type": "string",
          "description": "Caliber. Used by handguns, rifles, shotguns (as gauge), ammunition, AR parts, magazines.",
          "examples": ["9mm", ".45 ACP", ".223/5.56", "12ga", ".357 Mag"]
        },
        "action": {
          "type": "string",
          "description": "Action type. Handguns: Striker-Fired | Revolver | DA/SA | Single Action | DAO. Rifles: Semi-Auto | Bolt-Action | Lever-Action | Single Shot | Pump-Action. Shotguns: Pump-Action | Semi-Auto | Over-Under | Side-by-Side | Single Shot | Lever-Action.",
          "examples": ["Striker-Fired", "Bolt-Action", "Pump-Action", "Over-Under"]
        },
        "opticReady": {
          "type": "boolean",
          "description": "True if the firearm has a factory-milled or pre-cut optic mounting surface (pistol) or is otherwise optic-ready.",
          "examples": [true, false]
        },
        "hand": {
          "type": "string",
          "description": "Dominant-hand orientation of controls.",
          "enum": ["Right", "Left", "Ambidextrous"]
        },
        "capacity": {
          "type": "integer",
          "description": "Magazine/cylinder capacity in rounds. For handguns, rifles, shotguns, magazines.",
          "minimum": 1,
          "examples": [15, 17, 6, 30]
        },
        "barrelIn": {
          "type": "number",
          "description": "Barrel length in inches.",
          "minimum": 0,
          "examples": [4.02, 16.0, 18.5, 24.0]
        },
        "frameSize": {
          "type": "string",
          "description": "Handgun frame size.",
          "examples": ["Subcompact", "Compact", "Full-Size", "Long Slide"]
        },
        "safety": {
          "type": "string",
          "description": "Safety mechanism present on handgun.",
          "examples": ["Manual Safety", "No Manual Safety", "Thumb Safety", "Decocker"]
        },
        "finish": {
          "type": "string",
          "description": "Surface finish / color of the firearm.",
          "examples": ["Black", "Stainless", "FDE", "ODG", "Bronze"]
        },

        "_comment_rifles": {
          "type": "string",
          "description": "── RIFLES ───────────────────────────────────────────────────────"
        },
        "platform": {
          "type": "string",
          "description": "Rifle platform family.",
          "examples": ["AR-15", "AK", "Precision", "Hunting", "Rimfire"]
        },
        "features": {
          "type": "array",
          "description": "Array of notable feature tags on a rifle.",
          "items": {
            "type": "string",
            "examples": ["optic-ready", "threaded", "folding", "free-float", "night-vision-compatible"]
          }
        },

        "_comment_shotguns": {
          "type": "string",
          "description": "── SHOTGUNS ─────────────────────────────────────────────────────"
        },
        "gauge": {
          "type": "string",
          "description": "Shotgun gauge / bore diameter.",
          "examples": ["12ga", "20ga", ".410", "28ga", "16ga"]
        },
        "use": {
          "type": "string",
          "description": "Primary intended use. Shotguns: Home Defense | Hunting | Sport Shooting | Tactical. Ammunition: Target | Self-Defense | Hunting | Training.",
          "examples": ["Home Defense", "Hunting", "Target", "Self-Defense"]
        },

        "_comment_ammunition": {
          "type": "string",
          "description": "── AMMUNITION ───────────────────────────────────────────────────"
        },
        "bulletType": {
          "type": "string",
          "description": "Projectile construction type.",
          "examples": ["FMJ", "JHP", "SP", "Frangible", "Subsonic", "Buckshot", "Slug", "HP", "TMJ"]
        },
        "qty": {
          "type": "integer",
          "description": "REQUIRED for ammunition. Rounds per package/case. Used by ia-adapter.getPricePerRound() and the ¢/round display.",
          "minimum": 1,
          "examples": [50, 100, 200, 500, 1000]
        },
        "grains": {
          "type": "integer",
          "description": "Projectile weight in grains.",
          "minimum": 1,
          "examples": [115, 124, 147, 55, 62, 77]
        },
        "fps": {
          "type": "integer",
          "description": "Muzzle velocity in feet per second.",
          "examples": [1150, 3200, 900]
        },

        "_comment_optics": {
          "type": "string",
          "description": "── OPTICS ───────────────────────────────────────────────────────"
        },
        "opticType": {
          "type": "string",
          "description": "Optic category.",
          "examples": ["Red Dot", "Holographic", "LPVO", "Prism", "Scope", "Iron Sights", "Night Vision"]
        },
        "magnification": {
          "type": "string",
          "description": "Magnification range.",
          "examples": ["1x", "1-6x", "3-10x", "4-16x", "4x"]
        },
        "mount": {
          "type": "string",
          "description": "Mount type or tube diameter.",
          "examples": ["Picatinny", "30mm", "34mm", "1-inch"]
        },
        "reticle": {
          "type": "string",
          "description": "Reticle style.",
          "examples": ["BDC", "MOA", "MRAD", "Crosshair", "Circle Dot"]
        },

        "_comment_holsters": {
          "type": "string",
          "description": "── HOLSTERS ─────────────────────────────────────────────────────"
        },
        "carryPos": {
          "type": "string",
          "description": "Carry position.",
          "examples": ["IWB", "OWB", "AIWB", "Ankle", "Shoulder", "Pocket", "Duty"]
        },
        "material": {
          "type": "string",
          "description": "Holster material. Also used for magazines.",
          "examples": ["Kydex", "Leather", "Hybrid", "Nylon", "Polymer", "Steel", "Aluminum"]
        },
        "fits": {
          "type": "string",
          "description": "Firearm model or family this holster/magazine is compatible with.",
          "examples": ["Glock 17/19/26", "Sig P365", "1911", "Universal", "AR-15"]
        },

        "_comment_ar_parts": {
          "type": "string",
          "description": "── AR PARTS ─────────────────────────────────────────────────────"
        },
        "partType": {
          "type": "string",
          "description": "AR-15 part category.",
          "examples": ["Complete Upper", "Complete Lower", "Barrel", "BCG", "Handguard", "Trigger", "Stock", "Buffer", "Muzzle Device", "Lower Parts Kit"]
        },

        "_comment_cleaning": {
          "type": "string",
          "description": "── CLEANING ─────────────────────────────────────────────────────"
        },
        "productType": {
          "type": "string",
          "description": "Cleaning product category.",
          "examples": ["Cleaning Kit", "Solvent", "Oil", "CLP", "Bore Snake", "Patches", "Brush Set", "Wipes"]
        },
        "fitsCaliber": {
          "type": "string",
          "description": "Caliber or bore diameter this cleaning product is designed for.",
          "examples": ["Universal", "9mm", ".223/5.56", ".308/7.62", ".22 LR", "12 Gauge"]
        },

        "_comment_gun_safes": {
          "type": "string",
          "description": "── GUN SAFES ────────────────────────────────────────────────────"
        },
        "safeType": {
          "type": "string",
          "description": "Gun safe category.",
          "examples": ["Handgun Vault", "Long Gun Safe", "Large Floor Safe", "Biometric Pistol Safe", "Under-Desk Safe"]
        },
        "gunCapacity": {
          "type": "integer",
          "description": "Number of long guns or handguns the safe is rated to hold.",
          "minimum": 1,
          "examples": [1, 6, 12, 24, 48]
        },
        "lockType": {
          "type": "string",
          "description": "Primary lock mechanism.",
          "examples": ["Electronic", "Biometric", "Mechanical", "Key Lock"]
        },
        "fireRating": {
          "type": "string",
          "description": "Fire protection rating. 'None' if the safe has no fire rating.",
          "examples": ["None", "30 min", "60 min", "90 min", "120 min"]
        },
        "weightLbs": {
          "type": "number",
          "description": "Safe weight in pounds.",
          "minimum": 0,
          "examples": [2.3, 85, 420]
        }

      },

      "additionalProperties": true
    }

  }
}
